{
  "schema_version": "2.0",
  "period": {
    "period_key": "2026-07",
    "campaign_code": "ib_202607",
    "timezone": "Europe/Madrid",
    "target_post_count": 20,
    "publishing_start_date": "2026-07-01",
    "publishing_end_date": "2026-07-31"
  },
  "approval": {
    "review_status": "approved",
    "approval_authority": "human_workflow_dispatch",
    "approval_recorded_at": "2026-07-03T18:30:59.633Z",
    "original_cmo_review_status": "draft",
    "cmo_output_path": "marketing/agent-outputs/2026-07/cmo-strategy.json"
  },
  "approved_strategy": {
    "executive_summary": "July should establish Innerbloom’s first structured learning cycle rather than chase scale. The available June evidence shows a small Instagram-sourced acquisition signal, some CTA/auth-start events, and product usage concentrated in Innerbloom 2.0 areas, but analytics coverage is partial and previous posts have no measured post-level results. The strategy therefore prioritizes message-market learning around adaptive habits, clearer landing-to-auth intent, and product comprehension using existing assets, with 20 Instagram posts and no final captions.",
    "primary_objective": "Generate measurable early-adopter acquisition learning from Instagram while preserving a clear separation between landing interest, auth intent, registration, activation, and product usage.",
    "secondary_objectives": [
      "Improve clarity of Innerbloom’s adaptive-habit positioning through repeated but distinct message tests",
      "Create enough structured evidence for the next CMO run to choose a leading pillar or retire weak angles"
    ],
    "core_value_proposition": "Innerbloom helps people keep direction with adaptive habits that recalibrate to real life instead of forcing perfect consistency.",
    "period_narrative": "Real weeks, adaptive rhythm: build habits that bend without breaking.",
    "strategic_priorities": [
      "Validate which entry message creates the clearest acquisition intent: pain/friction, product mechanism, belief differentiation, or early-adopter feedback",
      "Make the landing-to-auth path measurable and interpretable without confusing it with product usage",
      "Reuse existing assets to run a lightweight, reviewable 20-post learning cycle before creating new production complexity"
    ],
    "content_pillars": [
      {
        "name": "Pain and friction",
        "role": "Surface the emotional cost of rigid streaks and perfect-day planning",
        "hypothesis": "People frustrated by broken streaks and restart cycles will be more likely to visit the landing page and click the CTA",
        "post_count": 8,
        "primary_funnel_stage": "acquisition",
        "sample_angles": [
          "streak pressure",
          "perfect-day planning breaks during real weeks",
          "recalibration instead of restart",
          "low-energy weeks should not erase progress"
        ],
        "avoid": "Do not shame users or claim Innerbloom fixes every consistency problem"
      },
      {
        "name": "Product mechanism and demo",
        "role": "Make adaptive rhythm concrete through product-backed explanations",
        "hypothesis": "Showing Daily Quest, dashboard progress, task intensity, and visible momentum will clarify how the promise works",
        "post_count": 5,
        "primary_funnel_stage": "registration_intent_and_activation_proxy",
        "sample_angles": [
          "Daily Quest fits the day available",
          "dashboard progress without perfection",
          "task intensity can adjust",
          "visible momentum after recalibration"
        ],
        "avoid": "Do not imply unlisted features or guarantee outcomes"
      },
      {
        "name": "Belief and differentiation",
        "role": "Define Innerbloom against rigid productivity and all-or-nothing habit systems",
        "hypothesis": "A clear anti-rigidity worldview will attract early adopters who identify with sustainable habit design",
        "post_count": 4,
        "primary_funnel_stage": "acquisition",
        "sample_angles": [
          "real weeks over perfect calendars",
          "progress without shame",
          "sustainable habit design",
          "consistency as recalibration"
        ],
        "avoid": "Do not attack specific competitors or overstate comparative proof"
      },
      {
        "name": "Early-adopter feedback CTA",
        "role": "Invite the right people to try the early product and shape it",
        "hypothesis": "Transparent early-stage CTAs will convert curious visitors into auth starts or feedback-ready users",
        "post_count": 3,
        "primary_funnel_stage": "registration",
        "sample_angles": [
          "try the early version",
          "help shape adaptive habits",
          "give feedback after using the dashboard"
        ],
        "avoid": "Do not present the MVP as finished or approved without human review"
      }
    ],
    "content_mix": {
      "total_posts": 20,
      "by_pillar": {
        "Pain and friction": 8,
        "Product mechanism and demo": 5,
        "Belief and differentiation": 4,
        "Early-adopter feedback CTA": 3
      },
      "by_format": {
        "square static": 12,
        "square carousel": 8
      },
      "by_funnel_stage": {
        "acquisition": 12,
        "registration": 3,
        "activation": 3,
        "product_usage_explanation": 2
      },
      "platforms": {
        "instagram": 20
      },
      "notes": "No final captions or post-by-post calendar are included. Head of Content should translate this mix into drafts after human review of the strategy."
    },
    "experiments": [
      {
        "name": "Pain-first hooks versus product-first hooks",
        "pillars": [
          "Pain and friction",
          "Product mechanism and demo"
        ],
        "hypothesis": "Pain/friction posts will produce a higher landing CTA rate than product mechanism posts because the audience problem is easier to recognize than the product solution.",
        "metric": "landing_cta_clicked divided by landing page sessions for posts in each pillar, using UTM and ib_post where available",
        "decision_criterion": "If one pillar produces at least 2x the CTA rate of the other with at least 10 landing sessions per tested pillar, prioritize that pillar next month; otherwise classify as inconclusive."
      },
      {
        "name": "Carousel explanation versus static statement",
        "pillars": [
          "Pain and friction",
          "Belief and differentiation",
          "Product mechanism and demo"
        ],
        "hypothesis": "Carousels will improve scroll/engagement and CTA intent for explanatory concepts compared with static statements.",
        "metric": "scroll events and landing_cta_clicked per session by format for UTM-tagged posts",
        "decision_criterion": "If carousel posts exceed static posts by 30% or more on CTA per session with comparable sessions, keep carousel for explanatory topics; otherwise reserve carousel for product demos only."
      },
      {
        "name": "Early-stage transparency CTA",
        "pillars": [
          "Early-adopter feedback CTA"
        ],
        "hypothesis": "Posts that explicitly say the product is early and feedback is welcome will generate more auth_started events per landing session than generic try-it CTAs.",
        "metric": "auth_started per landing session for Early-adopter feedback CTA posts",
        "decision_criterion": "If feedback CTA posts generate at least 3 auth_started events and outperform non-feedback posts on auth_started per session, keep transparent early-adopter CTAs; otherwise rewrite the CTA proposition."
      },
      {
        "name": "Product screenshot comprehension test",
        "pillars": [
          "Product mechanism and demo"
        ],
        "hypothesis": "Using the available Daily Quest screenshot will make the adaptive habit mechanism more concrete and increase landing CTA clicks versus abstract product mechanism visuals.",
        "metric": "landing_cta_clicked per session and dashboard_view event count for product mechanism posts that use screenshots versus reusable abstract visuals",
        "decision_criterion": "If screenshot-backed posts show higher CTA per session and at least one downstream dashboard_view event, request more product screenshots next cycle; otherwise reuse screenshots sparingly."
      }
    ],
    "head_of_content_brief": {
      "do": [
        "Create 20 Instagram draft posts from the pillar mix after this draft strategy is reviewed",
        "Separate acquisition, registration, activation, and product usage intent in post hypotheses",
        "Attach a measurable hypothesis and target metric to each draft",
        "Use approved CTAs and full UTM/ib_post tracking",
        "Flag any draft that requires a new asset before producing it"
      ],
      "do_not": [
        "Do not publish or schedule content from this CMO strategy alone",
        "Do not approve this strategy automatically",
        "Do not write claims based on unmeasured June performance",
        "Do not create captions that imply final product maturity",
        "Do not add unsupported product features"
      ],
      "approval_criteria": [
        "Draft maps to one of the four approved pillars",
        "Draft has one primary funnel intent",
        "Draft uses available format constraints",
        "Draft includes a measurable metric and tracking plan",
        "Draft is consistent with adaptive habits, real-life rhythm, recalibration, and progress without perfection pressure"
      ],
      "rejection_criteria": [
        "Caption is final/publish-ready before review",
        "Claim relies on missing metrics or invented results",
        "Post confuses product usage with acquisition",
        "Post needs unavailable assets without flagging the gap",